{
  "$schema": "http://json-schema.org/draft-07/schema#",
  "title": "ProtSpace Data Schema",
  "type": "object",
  "required": ["protein_ids", "features", "feature_data", "projections"],
  "properties": {
    "protein_ids": {
      "type": "array",
      "description": "Array of protein identifiers",
      "items": {
        "type": "string"
      }
    },
    "features": {
      "type": "object",
      "description": "Feature definitions including possible values and their visual representations",
      "additionalProperties": {
        "type": "object",
        "required": ["other_visible", "items"],
        "properties": {
          "other_visible": {
            "type": "boolean",
            "description": "Visibility state for items not explicitly listed"
          },
          "items": {
            "type": "array",
            "description": "Array defining the possible values, colors, shapes, and visibility for this feature",
            "items": {
              "type": "object",
              "required": ["label", "color", "shape", "visible"],
              "properties": {
                "label": {
                  "type": ["string", "null"],
                  "description": "The display label for this feature value"
                },
                "color": {
                  "type": "string",
                  "description": "RGBA color string for this feature value",
                  "pattern": "^rgba\\([0-9]{1,3},[0-9]{1,3},[0-9]{1,3},[0-9](?:\\.[0-9])?\\)$"
                },
                "shape": {
                  "type": "string",
                  "description": "Shape identifier for this feature value",
                  "enum": [
                    "asterisk",
                    "circle",
                    "cross",
                    "diamond",
                    "plus",
                    "square",
                    "star",
                    "triangle",
                    "wye",
                    "times"
                  ]
                },
                "visible": {
                  "type": "string",
                  "description": "Initial visibility state of this feature value",
                  "enum": ["true", "false", "other"]
                }
              },
              "additionalProperties": false
            }
          }
        },
        "additionalProperties": false
      }
    },
    "feature_data": {
      "type": "object",
      "description": "Feature values for each protein. Each property key must match a key defined in the 'features' object. The value for each key is an array of indices with length equal to the number of protein_ids. Each index must be at least 0 and less than the length of the corresponding feature's 'items' array. (Enforcing the dynamic upper bound requires custom validation.)",
      "additionalProperties": {
        "type": "array",
        "items": {
          "type": "integer",
          "minimum": 0
        },
        "additionalProperties": false
      }
    },
    "projections": {
      "type": "array",
      "description": "Dimensionality reduction projection information and coordinates",
      "items": {
        "type": "object",
        "required": ["name", "data"],
        "properties": {
          "name": {
            "type": "string",
            "description": "Name of the projection method"
          },
          "metadata": {
            "type": "object",
            "description": "Projection method parameters; structure may vary based on the method used.",
            "additionalProperties": true
          },
          "data": {
            "type": "array",
            "description": "2D coordinates for each protein. The outer array's length must equal the number of protein_ids.",
            "items": {
              "type": "array",
              "minItems": 2,
              "maxItems": 2,
              "items": {
                "type": "number"
              }
            }
          }
        }
      }
    },
    "additionalProperties": false
  }
}
