{
  "protein_ids": [
    "Q5VSL9",
    "I6R1R5",
    "A0JP26",
    "O14804",
    "A1A6M1",
    "P00358"
  ],
  "features": {
    "category": {
      "other_visible": false,
      "items": [
        {
          "label": "toxin",
          "color": "rgba(255,0,0,0.8)",
          "shape": "circle",
          "visible": "true"
        },
        {
          "label": "enzyme",
          "color": "rgba(0,0,255,0.8)",
          "shape": "square",
          "visible": "false"
        },
        {
          "label": null,
          "color": "rgba(128,128,128,0.8)",
          "shape": "triangle",
          "visible": "other"
        }
      ]
    },
    "family": {
      "other_visible": false,
      "items": [
        {
          "label": "3FTx",
          "color": "rgba(0,255,0,0.8)",
          "shape": "diamond",
          "visible": "true"
        },
        {
          "label": "PLA2",
          "color": "rgba(255,165,0,0.8)",
          "shape": "cross",
          "visible": "true"
        },
        {
          "label": null,
          "color": "rgba(128,0,128,0.8)",
          "shape": "square",
          "visible": "other"
        },
        {
          "label": "SVMP",
          "color": "rgba(0,0,255,0.8)",
          "shape": "star",
          "visible": "true"
        }
      ]
    }
  },
  "feature_data": {
    "category": [0, 1, 2, 1, 0, 1],
    "family": [0, 1, 2, 0, 3, 2]
  },
  "projections": [
    {
      "name": "UMAP",
      "metadata": {
        "n_neighbors": 20,
        "min_dist": 0.1,
        "metric": "euclidean"
      },
      "data": [
        [1.234, -0.567],
        [-0.707, 0.122],
        [0.5, 0.75],
        [1.0, -1.0],
        [1.4, 0.0],
        [0.0, 0.0]
      ]
    },
    {
      "name": "PCA",
      "data": [
        [0.5, 1.0],
        [-1.2, 0.8],
        [0.0, -0.5],
        [1.1, -1.0],
        [0.3, 1.2],
        [0.8, -0.2]
      ]
    }
  ]
}
